Nom,Localisation,Type,Etat_poste,Nb_place,Heure_operation,Long,Lat,MTM8_X,MTM8_Y
"48-788","Au 3075 boul. De L'Assomption. Métro de l'Assomption","Public","Poste public actif",2,"24H / 7J",-73.54670826011888,45.56891468606902,301154.2,5047668.3
"23-177","Au coin de l'avenue Desjardins et la rue Ontario E. Situé au nord-ouest de l'intersection","Public","Poste public actif",5,"24H / 7J",-73.5410571227539,45.55121870967869,301594.3,5045701.5
"48-341","Au coin de la rue Honoré-Beaugrand et la rue Sherbrooke E. Situé au nord-ouest de l'intersection","Public","Poste public actif",8,"24H / 7J",-73.53492631296695,45.596435162747646,302075.2,5050726.2
"48-865","Au 3235 avenue De Granby. Poste privé de Taxi Coop. Centre commercial Domaine","Privé","Poste prive actif",6,"24H / 7J",-73.54223957130279,45.581706607575406,301503.7,5049089.7
"23-184","Au coin de la rue Préfontaine et la rue Sherbrooke E. Situé au sud-ouest de l'intersection","Public","Poste public actif",1,"24H / 7J",-73.55738635189817,45.543091975193484,300318.7,5044799.1
"48-861","Au coin de la rue De Cadillac et la rue Hochelaga. Situé au nord-est de l'intersection","Public","Poste public actif",2,"24H / 7J",-73.5358357317383,45.57329517335842,302003.1,5048154.7
"23-910","Av. Valois - Ontario E.","Public","Poste public actif",4,"24H / 7J",-73.54374641534423,45.547239219814024,301384.1,5045259.3
"39-884","6425, boul. Léger (Réserve) / Mail Langelier. Privé Coop de l'Est","Privé","Poste prive actif",7,"",-73.62226732195127,45.62355347070872,295265.7,5053746.6
"39-870","6425 boul. Léger (Tigre Géant) / Mail Langelier.","En commun","Poste encommun actif",2,"",-73.62296469629514,45.623793579681966,295211.4,5053773.4
"39-278","10495, boul. Pie-IX / Centre commercial Forest. Privé Hochelaga","Privé","Poste prive actif",4,"",-73.634381222229,45.589019694844204,294314.6,5049910.3
"39-284","Au coin du boul. Henri-Bourassa et la rue Lacordaire. Situé au sud-est de l'intersection. Petro-Canada","En commun","Poste encommun actif",4,"De soir",-73.61936760367826,45.60662528405188,295489,5051865
"39-875","Au 11300 boul. Lacordaire. Poste privé de Taxi Coop de l'Est . Esso","Privé","Poste prive actif",8,"24H / 7J",-73.61901877301636,45.605647311912726,295516.1,5051756.3
"39-873","Au 6000 boul. Henri-Bourassa E. Poste privé de Taxi Hochelaga. Épicerie Super C","Privé","Poste prive actif",7,"24H / 7J",-73.61778434868774,45.607130833233256,295612.6,5051921
"39-871","Au coin de la rue De Charleroi et l'avenue Lamoureux. Situé au nord-est de l'intersection.","Public","Poste public actif",4,"18H30 à 9H",-73.62721252480696,45.59888413591831,294875.7,5051005.7
"39-277","Au coin de l'avenue Pelletier et le boul. Henri-Bourassa E. Situé au sud-est de l'intersection","Public","Poste public actif",3,"24H / 7J",-73.63998134819337,45.59850316807809,293879.5,5050965
"39-276","Au coin du boul. Saint-Michel et la rue Fleury E. Situé au nord-est de l'intersection","Public","Poste public actif",2,"24H / 7J",-73.64317703253613,45.57969367314508,293626.5,5048875.1
"39-274","Au coin du 3279 boul. Henri-Bourassa E et le boul. Saint-Michel. Situé au nord-est de l'intersection","Public","Poste public actif",1,"24H / 7J",-73.65041209391785,45.584213917021046,293062.8,5049378.5
"39-872","Au coin de l'avenue Georges-Pichet et la rue De Charleroi. Situé au nord-ouest de l'intersection","Public","Poste public actif",2,"24H / 7J",-73.62678337070975,45.59918440424656,294909.3,5051039
"39-874","Au 6425 boul. Léger. Mail Langelier","En commun","Poste encommun actif",7,"24H / 7J",-73.62300806560671,45.62305315143496,295207.9,5053691.1
"3-585","15760, boul. de Pierrefonds. Marché Akhawan. Poste privé de la compagnie Taxi Coop de l'Ouest","Privé","Poste prive actif",6,"24H / 7J",-73.8673209013275,45.478431284205975,276082.8,5037677.4
"3-31","4849, boul. Saint-Jean. Épicerie Provigo. Poste privé de la compagnie Taxi Coop de l'Ouest.","Privé","Poste prive actif",4,"24H / 7J",-73.8501506,45.4909606,277431.3,5039063.7
"3-29","9562, boul. Gouin O.. Bowl-O-Drome. Poste privé Taxi Coop de l'Ouest","Privé","Poste prive actif",10,"24H / 7J",-73.78057847301636,45.503620711983,282874.1,5040449.3
"45-917","Boul. Armand-Bombardier / boul. Perras. Situé au nord-ouest de l'intersection sur le boul. Armand-Bombardier","Public","Poste public actif",5,"",-73.59730238042603,45.63861771127216,297214.5,5055418.1
"45-902","Au coin de l'avenue Rita-Levi-Montalcini et du boul. Maurice-Duplessis.. Situé au sud-est de l'intersection","Public","Poste public actif",3,"24H / 7J",-73.57990084732972,45.63833878441171,298571,5055385.6
"49-740","Au coin de la rue Léonard-Chaigneau et la rue Notre-Dame E. Situé au nord-ouest de l'intersection","Public","Poste public actif",2,"24H / 7J",-73.48833577962341,45.69342707130519,305708.4,5061504.7
"49-690","Au coin du boul. De la Rousselière et de la rue Sherbrooke E. Situé au nord-ouest de l'intersection","Public","Poste public actif",10,"24H / 7J",-73.50534541534421,45.66930931353723,304383.5,5058824.4
"49-346","Au 12 900 rue Notre-Dame E. Centre Le Cardinal","En commun","Poste encommun actif",4,"24H / 7J",-73.48966608095094,45.65282410300077,305605.4,5056992.3
"45-554","Au coin du boul. Rivières-des-Prairies et le boul. Maurice-Duplessis. Situé au nord-ouest de l'intersection","Public","Poste public actif",5,"24H / 7J",-73.56180519206544,45.650804400000006,299982.8,5056769.7
"45-553","Au coin du boul. Maurice-Duplessis et le boul. Armand-Bombardier. Situé au nord-ouest de l'intersection","Public","Poste public actif",7,"24H / 7J",-73.58972327829588,45.63142808632133,297804.4,5054618.4
"49-349","Au 1484 boul. Saint-Jean-Baptiste / Les galeries Saint-Jean-Baptiste.  .","En commun","Poste encommun actif",5,"24H / 7J",-73.50467078710251,45.64213343116583,304435.9,5055804.2
"49-350","Au 12695 rue Sherbrooke E. Poste privé de Taxi Coop de l'Est. Épicerie Super C","Privé","Poste prive actif",3,"24H / 7J",-73.51107596249618,45.654911893409476,303936.8,5057224.4
"44-908","Le poste est situé au coin des rues Molson et William-Tremblay (sud-est).","Public","Poste public actif",5,"En tout temps",-73.56487921957398,45.54159271253005,299733.4,5044632.9
"44-860","Au coin du boul. Rosemont et la rue Châtelain. Situé au nord-est de l'intersection","Public","Poste public actif",5,"24H / 7J",-73.56208848992537,45.57575866708983,299954.3,5048429.7
"44-858","Au coin de la rue Saint-Zotique E et la rue Jeanne-Jugan. Situé au nord-est de l'intersection","Public","Poste public actif",7,"24H / 7J",-73.57042157636897,45.57934035936484,299304.3,5048828.3
"44-856","Au coin de la 13e avenue et le boul. Rosemont. Situé au nord-ouest de l'intersection","Public","Poste public actif",2,"24H / 7J",-73.57968378106307,45.554216384964484,298578.7,5046036.9
"44-843","Au coin de l'avenue Louis-Hébert et la rue Beaubien. Situé au nord-est de l'intersection","Public","Poste public actif",7,"24H / 7J",-73.59216785509489,45.54833438762879,297603.2,5045384.2
"44-722","Au coin de l'avenue Valois et Place Victor-Bourgeau. Situé au sud-est de l'intersection","Public","Poste public actif",5,"24H / 7J",-73.55602738042603,45.55092167950858,300425.4,5045669.2
"44-657","Au 2535 rue Masson. Poste privé Taxi Coop. Maxi","Privé","Poste prive actif",3,"24h / 7J",-73.5774145116394,45.5441224,298754.8,5044914.9
"44-311","Au coin de la 3e avenue et la rue Masson. Situé au nord-ouest de l'intersection","Public","Poste public actif",4,"24H / 7J",-73.57607889149222,45.54644772002215,298859.3,5045173.2
"44-310","Au coin de la 17e avenue et la rue Masson. Situé au sud-est de l'intersection","Public","Poste public actif",4,"24H / 7J",-73.57065010044607,45.55534327774547,299284.1,5046161.4
"35-693","Au coin de la rue Beaubien E et la rue De la Roche. Situé au nord-est de l'intersection","Public","Poste public actif",3,"24H / 7J",-73.600965499354,45.53880648359106,296914.9,5044326.2
"35-641","Au coin de la rue De Saint-Vallier et la rue Jean-Talon E . Situé au sud-ouest de l'intersection","Public","Poste public actif",4,"24H / 7J",-73.6043464,45.5347588,296650.3,5043876.7
"35-638","Au coin de l'avenue Chateaubriand et la rue Beaubien E. Situé au nord-ouest de l'intersection","Public","Poste public actif",3,"24H / 7J",-73.60391807713307,45.535426246246686,296683.9,5043950.9
"44-859","Au coin de la rue Bélanger et la rue Viau. Situé au nord-est de l'intersection. Institut de cardiologie","Public","Poste public temporaire",4,"24H / 7J",-73.58006572736485,45.57363409937181,298551,5048194.8
"35-640","Au coin de la rue Saint-Vallier et la rue De Bellechasse. Situé au sud-ouest de l'intersection","Public","Poste public actif",4,"24H / 7J",-73.61369419071707,45.53885833602515,295920.9,5044333.3
"44-568","Au 2925 rue Rachel E. Poste privé Diamond - Hochelaga. Provigo","Privé","Poste prive actif",2,"24H / 7J",-73.56170672750854,45.54500790240152,299981.4,5045012.3
"44-800","Au coin de la 16e avenue et la rue Bellechasse. Situé au nord-ouest de l'intersection","Public","Poste public actif",5,"24H / 7J",-73.57961940739187,45.557191334354386,298584,5046367.5
"44-312","Au coin de la 7e avenue et la rue Masson. Situé au nord-est de l'intersection","Public","Poste public actif",4,"24H / 7J",-73.57466483103053,45.54870517635146,298970,5045424
"44-857","Au coin du boul. L'Assomption et l'avenue Des Saules. Situé au sud-est de l'intersection","Public","Poste public actif",8,"24H / 7J",-73.55745577799098,45.5727129785681,300315.6,5048090.9
"35-538","Au coin de la rue Chabot et le boul. Rosemont. Situé au nord-ouest de l'intersection","Public","Poste public actif",4,"24H / 7J",-73.590476990139,45.54180404046599,297734.4,5044658.4
"7-922","1115, boul. Décarie. Poste privé de Champlain situé aux Galeries Norgate","Privé","Poste prive actif",2,"",-73.68346623439331,45.51538355317106,290466,5041734.6
"7-921","6005, boul. de la Côte-Vertu . situé devant la porte d'Air Inuit","En commun","Poste encommun actif",4,"",-73.7303930907379,45.478375910466426,286787.8,5037631.4
"7-920","boul. Pitfield au coin du boul. de la Côte-Vertu. Situé au nord-ouest de l'intersection sur le boul. Pitfield","Public","Poste public actif",8,"24H/7J",-73.72334857672121,45.482347955406375,287339.8,5038071.2
"7-813","Au 3131 boul. de la Côte-Vertu (RBC). Poste privé de Taxi Champlain","Privé","Poste prive actif",8,"24H/ 7J",-73.70399126029662,45.49803330178101,288857.5,5039810.3
"7-793","Au coin du 1115 Décarie et le boul. De la Côte-Vertu. Poste privé de Taxi Champlain","Privé","Poste prive actif",6,"24H / 7J",-73.68284701957396,45.51465315280705,290514.2,5041653.3
"7-73","Au 6600 boul. de la Côte-de-Liesse (Hotel Crowne Plaza). Poste privé de Taxi Diamond","Privé","Poste prive actif",3,"24H / 7J",-73.69228111045072,45.484378488114814,289769,5038290.6
"7-64","Au coin du boul. Decarie et de la rue Du College. Situé au sud-est de l'intersection","Public","Poste public actif",4,"24H / 7J",-73.67476451531371,45.50945567046777,291144.4,5041074.3
"7-814","Au 4545 boul. de la Côte-Vertu (Hotel Days Inn). Poste privé de Taxi Diamond","Privé","Poste prive actif",4,"24H / 7J",-73.7171502465576,45.48747336572323,287825.9,5038639.5
"7-65","Au coin du  boul. Édouard-Laurin et du boul. Décarie. Situé au sud-ouest de l'intersection","Public","Poste public actif",3,"24H / 7J",-73.68175818490295,45.51325629464034,290598.9,5041497.9
"7-815","Au coin du 1015 rue Décarie et du boul. de la Côte-Vertu. Poste privé de Taxi Diamond-Hochelaga","Privé","Poste prive actif",8,"24H / 7J",-73.66801643685898,45.50304441899878,291670.2,5040360.7
"7-71","Au 9191 boul.Cavendish (IKEA). Poste privé de Taxi Diamond","Privé","Poste prive actif",3,"24H / 7J",-73.69004094337765,45.49075493501157,289945.8,5038998.8
"7-63","Au 7700 Chemin de la Côte-de-Liesse (Quality Hotel). Poste privé de Taxi Diamond","Privé","Poste prive actif",4,"24H / 7J",-73.70099556878665,45.47824561462481,289086.1,5037610.7
"7-887","7000, Place Robert-Joncas / Hôtel Courtyard .","Privé","Poste prive actif",1,"7J / 24H",-73.7003602246063,45.493207496288235,289139.9,5039273.3
"42-729","Au 4325 rue Jean-Talon E. Poste privé de Taxi Coop de l'Est. Épicerie Maxi","Privé","Poste prive actif",6,"24h / 7J",-73.59004091772158,45.5698811401204,297772,5047778.6
"42-669","Au coin de la rue Buies et la rue Jean-Talon E. Situé au nord-ouest de l'intersection","Public","Poste public actif",5,"24H / 7J",-73.58635711709212,45.57270959910509,298059.9,5048092.6
"42-651","Au coin du boul. Viau et le boul. Robert. Situé au nord-est de l'intersection","Public","Poste public actif",8,"24H / 7J",-73.60504674950789,45.584319204499025,296602.8,5049384.5
"42-645","Au coin de la rue Fleuricourt et la rue Jarry. Situé au sud-est de l'intersection","Public","Poste public actif",5,"24H / 7J",-73.59249702593382,45.58264640715659,297581.9,5049197.4
"42-644","Au coin du boul. Couture et du boul. Viau. Situé au nord-est de l'intersection","Public","Poste public actif",2,"24H / 7J",-73.61461257882183,45.58892258157111,295857.1,5049897.1
"42-643","Au coin du boul. Couture et le boul. Lacordaire. Situé au nord-est de l'intersection","Public","Poste public actif",3,"24H / 7J",-73.6087067200989,45.596813593098624,296319.1,5050773.4
"42-302","Au coin de la rue Valdombre et la rue Jean-Talon E. Situé au sud-est de l'intersection","Public","Poste public actif",3,"24H / 7J",-73.57864865239259,45.587012968060726,298663.1,5049681.5
"42-300","Au 7445 boul. Langelier. Poste privé de Taxi Hochelaga. Walmart","Privé","Poste prive actif",6,"24H / 7J",-73.57290463757323,45.59246443345275,299111.8,5050286.9
"42-299","Au coin de la rue Bélanger et la rue De Choisy. Situé au nord-est de l'intersection","Public","Poste public actif",5,"24H / 7J",-73.57206000583494,45.58344955941366,299176.8,5049285
"42-730","Au 4270 rue Jean-Talon E. Poste privé de Taxi Coop de Montréal. Centre Le Boulevard","Privé","Poste prive temporaire",2,"24H / 7J",-73.58991914868773,45.56770046370933,297781.2,5047536.2
"42-650","Au coin du boul. Robert et la rue De Honfleur. Situé au nord-ouest de l'intersection","Public","Poste public actif",4,"24H / 7J",-73.59111857440439,45.593288909114676,297690.8,5050380
"16-784","Au 1 Carrefour Alexandre-Graham-Bell (Campus Bell). Poste privé de Taxi Diamond","Privé","Poste prive actif",4,"24H / 7J",-73.53992742750853,45.47260192130647,301678.1,5036964.7
"16-608","Au 3000 Wellington (Maxi). Poste privé de Taxi Pontiac","Privé","Poste prive actif",5,"24H / 7J",-73.56346197619627,45.47110801519941,299837.9,5036799.8
"16-606","Au coin de la rue Rushbrooke et la rue Caisse. Situé au sud-ouest de l'intersection","Public","Poste public actif",2,"24H / 7J",-73.56543581055905,45.47053027771151,299683.5,5036735.8
"16-605","Au 4000 Boul. Lasalle (Hopital de Verdun)","Public","Poste public actif",5,"24H / 7J",-73.56448757619626,45.46421646675062,299757.1,5036034.1
"16-601","Au coin de la rue Berlioz et le boul. Ile-des-soeurs. Situé au sud-ouest de l'intersection","Public","Poste public actif",3,"24H / 7J",-73.54436874389648,45.45936305580227,301330.1,5035493.6
"16-149","Au coin de la rue De Verdun et la 1e Avenue. Situé au nord-est de l'intersection","Public","Poste public actif",5,"24H / 7J",-73.5718899211792,45.45874026939313,299177.7,5035426
"16-148","Au coin de l'avenue Brown et l'avenue Bannantyne. Situé au nord-ouest de l'intersection","Public","Poste public actif",5,"24H / 7J",-73.5771472280029,45.4481313611597,298765.4,5034247.4
"16-147","Au coin de l'avenue Bannantyne et le boul. Lasalle (Hopital Douglas). Situé au nord-ouest de l'intersection","Public","Poste public actif",5,"24H / 7J",-73.57710644550781,45.44373877231892,298768.1,5033759.2
"15-144","Au coin du boul. Monk et la rue Allard. Situé au sud-ouest de l'intersection","Public","Poste public actif",4,"24H / 7J",-73.59333876347654,45.45102334906249,297499.2,5034570.1
"15-143","Au coin de la rue Lacroix (Métro Angrignon) et le boul. Des Trinitiares. Situé au nord-ouest de l'intersection","En commun","Poste encommun actif",6,"24H / 7J",-73.60134189682003,45.446535435785286,296872.6,5034072.1
"15-142","Au coin de la rue Le Caron et la rue Laurendeau. Situé au sud-ouest de l'intersection","Public","Poste public actif",2,"24H / 7J",-73.58818816931154,45.46191799983127,297903.4,5035780.4
"15-140","Au coin de la rue Monk (Métro Jolicoeur) et la rue Jolicoeur. Situé au nord-ouest de l'intersection","Public","Poste public actif",4,"24H / 7J",-73.5822687232178,45.45708240539611,298365.8,5035242.5
"15-139","Coin de la rue Denonville et du boul. Monk. Situé au nord-ouest de l'intersection.","Public","Poste public actif",2,"24H / 7J",-73.59717796934206,45.46105380432641,297200.3,5035685.2
"16-603","Au coin de la rue De Gaspé et le boul. Ile-des-soeurs. Situé au nord-ouest de l'intersection","Public","Poste public actif",3,"24H / 7J",-73.54705095291138,45.453598330697254,301119.9,5034853.1
"16-145","Au coin de la 5e Avenue et la rue De Verdun. Situé au nord-est de l'intersection","Public","Poste public temporaire",4,"24H / 7J",-73.57215642929077,45.4564690079286,299156.6,5035173.6
"16 - 890","Situé sur la rue de L'Église au coin de la rue Wellington (sud-est de l'intersection)","Public","Poste public actif",5,"24H/7J",-73.56655083062742,45.46302220208495,299595.6,5035901.5
"16-602","Au 42 Place du Commerce (Provigo). Poste privé de Taxi Diamond","Privé","Poste prive actif",2,"24H / 7J",-73.54448240132751,45.46649177296971,301321.6,5036285.8
"16-151","Au coin de la rue Woodland et l'Avenue Bannantyne. Situé au sud-ouest de l'intersection","Public","Poste public actif",2,"24H / 7J",-73.57629775239258,45.45279683010753,298832.3,5034765.8
"16-607","Au 30 Place du Commerce (IGA). Poste privé de Taxi Pontiac","Privé","Poste prive actif",5,"24H / 7J",-73.53984383068848,45.46837549153415,301684.5,5036495
"15-141","Au coin de la rue Jolicoeur et le boul. Monk. Situé au sud-ouest de l'intersection","Public","Poste public actif",2,"24H / 7J",-73.59520769950564,45.45681148060742,297353.8,5035213.5
"20-904","Av. McGill College / Cathcart. Situé au Nord-Ouest de l'intersection sur av. McGill College","Public","Poste public actif",6,"",-73.57036198161468,45.50146305987272,299301.3,5040173.7
"20-899","1390, boul. René-Lévesque O.. Hôtel Holiday Inn Suites. Le poste est situé derrière l'hôtel. Poste privé de Pontiac","Privé","Poste prive actif",2,"",-73.57243338332823,45.49514959237528,299138.8,5039472.2
"21-919","208, rue Saint-Antoine O. - Hôtel Embassy Suites","Privé","Poste prive actif",2,"24h / 7j",-73.55897555945513,45.504174287632914,300191.4,5040474.2
"21-900","250, boul René-Lévesque O. / AC Hôtel Mariott","Privé","Poste prive actif",2,"24H / 7J",-73.56348483862303,45.5057756829141,299839.2,5040652.5
"20 - 904","Av. McGill College coin rue Cathcart","Public","Poste public actif",6,"24 H / 7 J",-73.57125742009885,45.50190536852262,299231.4,5040222.9
"20-899","1390, boul René-Lévesque O. . Hôtel Holiday Inn & Suites. Derrière l'hôtel","Privé","Poste prive actif",2,"24H / 7J",-73.57247093425445,45.49521351734022,299135.9,5039479.3
"22-810","Au coin de la rue Sainte-Catherine E et la rue Montcalm. Situé au nord-ouest de l'intersection","Public","Poste public actif",4,"24H / 7J",-73.55635539364016,45.51834019510486,300397.2,5042048.4
"22-172","Au coin de la rue Sainte-Catherine E et la rue Plessis. Situé au sud-ouest de l'intersection","Public","Poste public actif",6,"Soir",-73.55432871954343,45.52044815312354,300555.7,5042282.5
"22-171","Au coin de la rue Plessis et la rue Sherbrooke E. Situé au sud-est de l'intersection","Public","Poste public actif",8,"24H / 7J",-73.56454861157545,45.52537112578774,299757.8,5042830.2
"22-170","Au coin de la rue Fullum et la rue Sainte-Catherine E. Situé au sud-ouest de l'intersection","Public","Poste public actif",5,"24H / 7J",-73.54813241945521,45.52710404071346,301040.2,5043021.9
"22-169","Au coin de la rue Du Havre et la rue Ontario E. Situé au sud-est de l'intersection","Public","Poste public actif",10,"24H / 7J",-73.55213621957398,45.53350276907257,300728,5043733.2
"22-168","Au coin de la rue Dorion et la rue Sainte-Catherine E. Situé au nord-est de l'intersection","Public","Poste public actif",8,"24H / 7J",-73.5515042883606,45.52369599529935,300776.6,5042643.3
"21-819","Au 1400 boul. René-Levesque E (Maison de Radio-Canada)","En commun","Poste encommun actif",4,"24H / 7J",-73.55218630265506,45.51853510952077,300723,5042069.8
"21-818","Au coin de la rue Sherbrooke E et la rue Plessis . Situé au sud-est de l'intersection","Public","Poste public actif",3,"24H / 7J",-73.56468808644422,45.525431258051476,299746.9,5042836.9
"21-798","Au coin de la rue Saint-Antoine O et le boul. Saint-Laurent. Situé au sud-ouest de l'intersection","Public","Poste public actif",12,"LUN au VEN 8h à 18h",-73.55719184888585,45.506740901271854,300331,5040759.4
"21-790","Au coin de la rue Saint-Jacques et la rue Saint-Francois-Xavier. Situé au sud-est de l'intersection","Public","Poste public actif",6,"24h / 7J",-73.55810809141985,45.5042632279351,300259.2,5040484.1
"21-781","Au 380 boul. René-Levesque O (Derrière hôtel Marriot Courtyard). Poste privé de Taxi Pontiac","Privé","Poste prive actif",3,"24H / 7J",-73.5639564693115,45.50522566819983,299802.2,5040591.4
"21-738","Au 270 rue Saint-Antoine O (Hotel Westin). Poste privé de Taxi Pontiac","Privé","Poste prive actif",1,"24h / 7J",-73.55980014603273,45.50369207779791,300126.9,5040420.7
"21-723","Au coin de l'avenue Viger O et la rue Côté. Situé au nord-est de l'intersection","Public","Poste public actif",4,"24H / 7J",-73.56037179377898,45.50584338087859,300082.4,5040659.8
"21-512","Au coin du 10 rue Saint-Antoine (Palais de justice) et la rue Saint-Laurent. Situé au sud-est de l'intersection","Public","Poste public actif",2,"LUN à VEN 8h à 18h",-73.55719029895022,45.50690096283205,300331.1,5040777.2
"21-484","Au coin du boul. René-levesque O et la rue Clark. Situé au nord-ouest de l'intersection","Public","Poste public actif",2,"24H / 7J",-73.56213411904906,45.50850358653793,299944.9,5040955.5
"21-405","Au coin du 999 rue Saint-Urbain (Holiday Inn) et la rue Viger O. Poste privé de Taxi Pontiac","Privé","Poste prive actif",4,"24H / 7J",-73.55979228465577,45.506529195032385,300127.8,5040736
"21-402","Au coin de la rue Saint-Hubert et la rue Sainte-Catherine E. Situé au sud-est de l'intersection","Public","Poste public actif",7,"24H / 7J",-73.55875256403198,45.51535554169436,300209.7,5041716.8
"21-394","Au Casino de Montréal, réserve au sud-est","En commun","Poste encommun actif",18,"24H / 7J",-73.52462128570556,45.50707528020413,302876.1,5040795.2
"21-393","Au coin du 175 boul. René-levesque O et le complexe Desjardins. Situé au nord-est de l'intersection","Public","Poste public actif",10,"24H / 7J",-73.56307986983643,45.507505294176624,299870.9,5040844.7
"21-387","Au 1 Avenue Du Casino","Public","Poste public actif",3,"24H / 7J",-73.52579042883605,45.50565404153001,302784.7,5040637.3
"20-770","Au coin de la rue Wellington et la rue Queen. Situé au sud-ouest de l'intersection","Public","Poste public actif",5,"24H / 7J",-73.55533886931153,45.497548456856244,300475.1,5039737.7
"20-760","Au coin de la rue Du Square-Victoria et la rue Saint-Antoine O. Situé au nord-est de l'intersection","Public","Poste public actif",6,"24H / 7J",-73.56195000503237,45.50146963579833,299958.7,5040173.8
"20-758","Au 380 rue Sherbrooke Ouest (Hotel Hilton Garden Inn). Poste privé de Taxi Pontiac","Privé","Poste prive actif",2,"24H / 7J",-73.57140215648349,45.50779168632687,299220.7,5040877
"20-751","Au coin de la rue Saint-Mathieu et la rue Sainte-Catherine O. Situé au nord-est de l'intersection","Public","Poste public actif",6,"24H / 7J",-73.57931882698364,45.493922573703045,298600.5,5039336.3
"20-681","Au coin du boul. René-Levesque O et la rue Lucien-L'Allier. Situé au sud-est de l'intersection","Public","Poste public actif",3,"24H / 7J",-73.57291883467099,45.495697750433024,299100.9,5039533.1
"20-678","Au coin de la Place Monseigneur-Charbonneau et la Place Ville-Marie. Situé au nord-ouest de l'intersection","Public","Poste public actif",4,"24H / 7J",-73.56834765263977,45.502201911728356,299458.8,5040255.6
"20-673","Au coin du 800 boul. René-Levesque O et le boul. Robert-Bourassa. Situé au sud-ouest de l'intersection","Public","Poste public actif",3,"24H / 7J",-73.56728730793458,45.501708666214235,299541.6,5040200.7
"20-666","Au coin de la rue Saint-Antoine O et la rue Gauvin. Situé au sud-ouest de l'intersection","Public","Poste public actif",5,"24H / 7J",-73.56200931852413,45.501154263778005,299954.1,5040138.8
"20-619","Au 1625 Av. Des Pins O (Hopital Général Montréal-Livingston Hall)","En commun","Poste encommun actif",2,"24H / 7J",-73.5876556,45.4966242,297949.3,5039637.2
"20-614","Au coin du 3450 rue Drummond et Place Mountain. Situé au nord-ouest de l'intersection","Public","Poste public actif",2,"24H / 7J",-73.57879712988586,45.500750247791885,298642.1,5040095.1
"20-611","Au 687 Avenue Des Pins (Hopital Royal Victoria)","Public","Poste public actif",2,"24H / 7J",-73.58020687036134,45.50811772458275,298532.7,5040913.9
"20-467","Au coin de l'Avenue Union et la rue Sainte-Catherine O. Situé au nord-est de l'intersection","Public","Poste public actif",8,"24H / 7J",-73.56926618650817,45.50385781373937,299387.2,5040439.7
"20-466","Au coin de la rue Saint-Maurice et la rue Mcgill. Situé au sud-ouest de l'intersection","Public","Poste public actif",5,"24H / 7J",-73.55830545183716,45.500492861115795,300243.5,5040065.1
"20-460","Au coin de la rue Stanley et Sainte-Catherine O. Situé au sud-ouest de l'intersection","Public","Poste public actif",5,"24H / 7J",-73.57350311904906,45.49917043895496,299055.6,5039919.1
